<?xml version="1.0" encoding="UTF-8"?>
<customer xmlns="http://mobileoperator.com/schema/customer"
          xmlns:base="http://mobileoperator.com/schema/base-types"
          xmlns:xsi="http://www.w3.org/2001/XMLSchema-instance"
          xsi:schemaLocation="http://mobileoperator.com/schema/customer customer.xsd">

    <id>a1b2c3d4-e5f6-7a8b-9c0d-1e2f3a4b5c</id>
    <fullName>Іваненко*Петро</fullName>
    <phoneNumber>0971234567</phoneNumber>
    <email>invalid.email.com</email>
    <createdAt>2023-10-15T10:00:00</createdAt>
    <tariffId>f1e2d3c4-b5a6-9b8c-7d6e-5f4a3b2c1d0e</tariffId>
    <isActive>NotBoolean</isActive>
</customer>